{
  "id": "releases/2026-01-05/manifest.json",
  "kind": "manifest",
  "format": "manifest/2.0",
  "provenance": {
    "release": "2026-01-05",
    "sources": ["example"],
    "licences": ["CC-BY-4.0"],
    "gbif_download_dois": ["10.0000/example"],
    "method": "test-1",
    "taxonomy": "test-taxonomy",
    "boundaries": "test-boundaries",
    "ranges": null,
    "protection": null,
    "code": "0.0.0",
    "run": "run-1"
  },
  "data": {
    "release": "2026-01-05",
    "published_at": "2026-01-05T06:00:00Z",
    "parts": 1,
    "files": [
      {
        "path": "notes.json",
        "sha256": "d72198a45d5d50d85ad358a96ec1bced2fe4b962d457637b53b06ccd7c02c645",
        "format": "notes/1.0",
        "bytes": 479
      },
      {
        "path": "catalogue/0.json",
        "sha256": "2a3344a242d29ccc3c43c8f7ae2f6b41cbde33b662f052685df99ae2540c8848",
        "format": "catalogue/1.3",
        "bytes": 1031
      },
      {
        "path": "catalogue/1.json",
        "sha256": "47d313ad426c0ac451a49adef9e99d9cf537544d21d239c9fd5f69adee608f85",
        "format": "catalogue/1.3",
        "bytes": 718
      },
      {
        "path": "species/EX1.json",
        "sha256": "7d787b42dac50f5f604ec1dfb44533079393d13f74e7518b3dc2bd0cf24b7126",
        "format": "species/1.11",
        "bytes": 1669
      },
      {
        "path": "slugs.json",
        "sha256": "95ec15fbafe5fc4154e4058e0e04a1e9a267aa82d24acd3212292bb35532338e",
        "format": "slugs/1.0",
        "bytes": 426
      },
      {
        "path": "groups.json",
        "sha256": "c44aad6138d2f9e7b1ac7a8165c03ec476ad767f5a34b306479175adb8cee7f2",
        "format": "groups/1.0",
        "bytes": 420
      },
      {
        "path": "search/index.json",
        "sha256": "8571c6ad55d1b6873ca13ce317d4675585f91b6c554388bcdddc8101f10f6752",
        "format": "search/1.1",
        "bytes": 476
      },
      {
        "path": "regions/us-zz.json",
        "sha256": "8f89f044321a6c03812eac6793fcfe7a3d67cb402235c2b73a9c7e17a6b8ec47",
        "format": "region/1.0",
        "bytes": 694
      },
      {
        "path": "attribution/us-zz/EX1.json",
        "sha256": "807fc40d386fcf0fdefb2ff4db5e3e1fe6e8c3a74b2ec45cf79d26e316115fce",
        "format": "attribution/1.0",
        "bytes": 589
      },
      {
        "path": "backyard/us-zz/99001.json",
        "sha256": "376554c40305f481624346c89b853ed7fc36a0acec84ccda28bf62a96d12fc76",
        "format": "backyard/1.1",
        "bytes": 904
      },
      {
        "path": "methods.json",
        "sha256": "c124c4547068eaf3d4d7263bbb53318e76a8f378e4cfaa33849179e0d4f4a88d",
        "format": "methods/1.0",
        "bytes": 594
      },
      {
        "path": "sources.json",
        "sha256": "f1dfbe65e9a45842fed146232f65d39088e992ee38ddca4ca5025761835c9017",
        "format": "sources/1.0",
        "bytes": 558
      },
      {
        "path": "places/us-zz/boundaries.json",
        "sha256": "d1393bd33951a3a35c594c03f3c1633521d0e9605d6d21695a3a9521ff5cea85",
        "format": "boundaries/1.0",
        "bytes": 577
      },
      {
        "path": "places/us-zz/cities.json",
        "sha256": "e4772568c8b7834bc353c384a993ff38511c0b76f52b9452ac162e903144ea36",
        "format": "cities/1.0",
        "bytes": 508
      },
      {
        "path": "postal/us/999.json",
        "sha256": "2e991fb572d688ad665760fd1d9ad61f181e94c73d45cc40aa81d2541ea6f73a",
        "format": "postal/1.0",
        "bytes": 406
      },
      {
        "path": "results/us-zz/EX1.json",
        "sha256": "5320f5ff4050bea70111e2f731116797ad7fb2fde9f5ab955140ef7bd3427e1d",
        "format": "state-weekly/1.0",
        "bytes": 1047
      },
      {
        "path": "results/us-zz/99001/EX1.json",
        "sha256": "6502115386a34b5e9b7046a0d5f4633aa6ed1bba729a8df90e8b62de634d5293",
        "format": "county-weekly/1.0",
        "bytes": 1055
      },
      {
        "path": "archive.tar.gz",
        "sha256": "eac08293266f6a619ff1dc43a3100fb86aaf596bd581fc111d3818cef37a066c",
        "format": null,
        "bytes": 15
      }
    ],
    "counts": {
      "species": 2,
      "state_results": 1,
      "county_results": 1,
      "records": 120
    }
  }
}
